{
  "schemaVersion": 1,
  "id": "base",
  "version": "0.1.0",
  "author": "UniversalisRPG",
  "locales": ["en"],
  "combatBalance": {
    "damage-scaler": 0.1
  },
  "experienceCurve": {
    "starting-experience": 1000,
    "level-factor": 10,
    "exponential": 2
  },
  "basePlayer": {
    "inventory": {},
    "bank": {
      "gold": 25
    }
  },
  "maxInventorySlots": 28,
  "ui": {
    "distanceBetweenAdjacentTiles": 1,
    "timeFlowsContinuously": false
  },
  "files": [
    "locales/en.json"
  ],
  "modules": [
    "base-core",
    "tutorial-island-foundation",
    "tutorial-island-guide-house",
    "tutorial-island-survival",
    "tutorial-island-bank",
    "tutorial-island-mining",
    "tutorial-island-combat"
  ],
  "compatibility": {
    "minAppVersion": "0.1.0"
  }
}
